no,company,date,title,content,,,,,,,,,,,,,,,,,,,,,
151,티에이케이정보시스템(주),2018.10.16,"영림원소프트랩, 티에이케이정보시스템과 ERP‧MES 등 업무 협력으로 비즈니스 혁신","영림원소프트랩이 티에이케이정보시스템과 영림원의 ERP와 티에이정보시스템의 TMS, MES, 그룹웨어 사업에 대해 협력하기로 하고 양해각서를 체결했다.
양사의 교류 확대로 새로운 수익 창출 '시너지'

[인더스트리뉴스 박관희 기자] 국내 대표적 전사적자원관리(ERP) 전문 기업 영림원소프트랩(대표 권영범, 이하 영림원)과 도레이첨단소재의 계열사, 토털(Total) IT 솔루션 기업인 티에이케이정보시스템은 16일 영림원의 ERP 사업과 티에이케이정보시스템의 TMS, MES와 그룹웨어 사업에 대한 협력을 위해 양해각서(MOU)를 체결했다.

티에이케이정보시스템(구 새한정보시스템)은 삼성그룹에서 분리할 때 삼성SDS로부터 분사한 회사이다. 현재는 도레이첨단소재 IT계열사로서 IT서비스를 제공하고 있다.

이번 MOU를 통해 영림원소프트랩은 ERP 사업의 확장과 솔루션 벤더로서의 지속적 성장을 기대한다고 밝혔고, 티에이케이정보시스템은 영림원소프트랩 'K-System Genuine'의 전략적 파트너로서 영업, 프로젝트, 개발, 유지보수 등의 역할을 자체 수행하게 된다. 또한 티에이케이정보시스템의 보유 솔루션에 대한 사업 협력도 같이 수행하게 된다.

양사는 앞으로 각사가 보유한 강점을 바탕으로 국내외 시장을 대상으로 ERP 솔루션 및 TMS, MES, 그룹웨어를 중심으로 사업화를 지속적으로 추진할 계획이다.

영림원소프트랩은 25년간 ERP 사업에 주력해 현재 국내외에 1,700여개의 고객기업을 보유하고 있다. ‘K-System Genuine’은 중견기업에 최적화된 시스템경영 ERP로 보다 실용적인 정보화와 경영 역량을 지원한다. 특히 모바일 환경에 특화되어 PC에서 사용되는 모든 기능이 모바일에서도 그대로 구현된다. 고객은 개별 사용자 활동 시점에서 정보를 공유함으로써 IT 환경 변화에 유연하게 대응할 수 있다.

티에이케이정보시스템의 김진규 대표는 ""영림원의 ERP 사업의 영업, 프로젝트, 개발, 유지보수 등의 역할을 전략적 파트너로서 티에이케이정보시스템이 자체 수행할 것""이라고 소개하며, ""티에이케이정보시스템의 보유 솔루션인 TMS, MES 및 그룹웨어, 전자결재, 콜센터, 컨택센터 분야의 사업 협력도 함께 수행하고, 이를 통해 더욱 치열해지는 IT시장에서 더욱 경쟁력을 갖추게 될 것""이라고 밝혔다.

영림원소프트랩의 권영범 대표는 ""이번 협약으로 on Premise ERP 사업에서의 양사의 교류 확대로 비즈니스를 혁신하고 새로운 수익을 창출하는 등의 시너지 효과가 극대화되기를 바란다""고 말했다.

",,,,,,,,,,,,,,,,,,,,,
152,티에이케이정보시스템(주),2024.06.13,"티에이케이정보시스템, KISA 지능형 CCTV 성능 인증 획득","티에이케이정보시스템은 지난 6월 13일 한국인터넷진흥원(KISA)으로부터 '지능형 CCTV 성능 인증'을 획득하였습니다. 

 

             

 

지능형 CCTV는 카메라를 이용해 영상 기반 객체 및 이상 상황 등을 탐지, 분석하여 화재, 방화, 침입 등 특정 상황을 자동으로 인식하고 처리하는 시스템입니다.

한국인터넷진흥원에서 실시하는 지능형 CCTV 성능시험 인증은 CCTV의 식별 및 탐지 알고리즘 성능에 대한 시험으로, 이를 획득하기 위해서는 제시한 조건에 90% 이상의 검출 정확도가 필요합니다.

 

       
 

티에이케이정보시스템은 지능형 CCTV 성능시험 중 배회 항목에서 90% 이상의 검출 정확도를 달성해 이번 인증을 획득하였습니다. 인증받은 배회 감지 기술은 티에이케이정보시스템의 영상 관제 솔루션 'XFUSION VOA'에 활용될 예정입니다.

 

인공지능 기반의 영상 관제 솔루션 XFUSION VOA는 산업현장의 위험요소를 사전에 감지하고 대응하는 산업안전 관리 솔루션으로 실시간 알림 기능을 통해 산업현장의 위험을 실시간으로 파악하여 재해예방의 골든 타임을 확보할 수 있으며 다수의 CCTV 모니터링 및 관리 문제를 해결할 수 있는 대안이 될 것으로 예상됩니다. ",,,,,,,,,,,,,,,,,,,,,
153,한솔인티큐브(주),2024.09.24,"한솔인티큐브, 클라우드 기반 컨택센터 한솔 클라우드 씨에스 출시","국내 대표 컨택센터 솔루션 기업 한솔인티큐브가 자체 개발한 ‘한솔 클라우드 씨에스(가칭)’를 출시했다고 24일 밝혔다.

과거에는 컨택센터 설립 시 설비 투자와 공간 확보 등 많은 초기 비용이 필요했지만, 이번에 출시된 ‘한솔 클라우드 씨에스’는 클라우드 기반으로 공간의 제약이 없고, 사용량에 따라 비용을 청구하기 때문에 투자비용이 부족한 기업들에게 적합하다는 평가가 나온다.


한솔 클라우드 씨에스는 전화·카카오톡 인공지능(AI) 상담 등의 기능을 제공한다. 상담 시작부터 종료까지 전 단계를 하나의 시스템으로 통합 관리할 수 있는 올인원 상담 플랫폼이다.

고객의 사업규모와 상담수요 변화에 따라 즉각적인 클라우드 확장 및 축소가 가능하며 개방형 인터페이스를 통해 생성형 AI와 같은 최신 기술과의 연계가 쉬운 편이다.

또, 한솔 클라우드 씨에스는 고객에게 메시지를 전송할 수 있는 문자 메시지(SMS, MMS), 알림톡 기능을 기본으로 제공해, 대량 발송 및 매크로 기능으로 고객 맞춤형 메시지 발송이 가능하다.



한편, 한솔 클라우드 씨에스는 AI·클라우드 전문기업인 네이버 클라우드의 마켓플레이스에 입점했다. 향후 네이버 클라우드의 생성형 AI인 하이퍼클로바 엑스를 포함한 다양한 서비스와의 연동을 추진할 계획이다.

10월 말까지 한솔 클라우드 씨에스를 계약한 고객들은 약정 기간에 따라 추가 서비스 이용 기간을 무료로 제공받을 수 있다. 한솔인티큐브 관계자는 “한솔 클라우드 씨에스는 20년 넘게 축적해온 노하우를 바탕으로 자체 개발한 컨택센터 플랫폼”이라며 “앞으로도 차별화된 서비스 모델을 제시하여 클라우드 컨택센터의 가치를 높이고 시장을 선도해 나갈 것”이라고 말했다.
",,,,,,,,,,,,,,,,,,,,,
154,한솔인티큐브(주),2024.09.13,한솔인티큐브 수주공시 - NS홈쇼핑 디지털컨택센터 콜시스템 고도화 구축 29억원 (매출액대비 7.0 %),"◆한솔인티큐브 수주공시 개요
- NS홈쇼핑 디지털컨택센터 콜시스템 고도화 구축 29억원 (매출액대비 7.0 %)

한솔인티큐브(070590)는 NS홈쇼핑 디지털컨택센터 콜시스템 고도화 구축에 관한 단일판매ㆍ공급계약체결(자율공시) 을 13일에 공시했다.
계약 상대방은 (주)케이티이고, 계약금액은 29억원 규모로 최근 한솔인티큐브 매출액 416.8억원 대비 약 7.0 % 수준이다. 이번 계약의 기간은 2024년 09월 09일 부터 2025년 07월 11일까지로 약 10개월이다.
한편 이번 계약수주는 2024년 09월 12일에 체결된 것으로 보고되었다.

한편, 오늘 분석한 한솔인티큐브는 한솔그룹 계열 CRM 및 메시징서비스 제공기업으로 알려져 있다.
",,,,,,,,,,,,,,,,,,,,,
155,한솔인티큐브(주),2018-12-27,"""컨택센터 등에 AI기반 신기술로 시선""","지디넷코리아가 과학기술정보통신부(과기정통부) 후원을 받아 주최한 '제2회 4차산업혁명 대상'에서 정보통신기술진흥센터장상은 한솔인티큐브(대표 고광선)가 출품한 AI 챗봇 '아이작(ISAC)'이 차지했다.

'아이작'은 빅데이터, AI 기반 차세대 커뮤니케이션 비전을 만들어가는 한솔인티큐브의 브랜드 네이밍이다. 일종의 AI 플랫폼이다. 커뮤니케이션과 인공지능을 기반으로 한다. 챗봇과 음성봇, 상담지원 봇, RPA(Robotic Process Automation)기능을 갖췄다.

콜인프라 연동을 구현하는 방식에 따라 고객사의 인프라와 통합하는 범위가 달라질 수 있다. 기본적으로 교환기와의 연동은 필수다. 특히 고객 UX와 기업의 빅데이터 인사이트를 바탕으로 개인화 서비스를 제공한다.

복잡한 기업 비즈니스를 GUI환경을 통해 다양하게 구현이 가능하다. 비IT 업무담당자가 손쉽게 운영 및 관리할 수 있게 설계됐다.


고광선 한솔인티큐브 대표는 ""20년간 콜센터 관련 인프라와 응용프로그램을 납품했던 경험을기반으로 사용자 관점으로 기술을 도입 및 응용, 사용현장에서의 편리성에 초점을 두고 제품을 개발했다""면서 ""각 엔진 요소는 오케스트레이터로 중앙에서 관리하고 추후 기능 확장도 오케스트레이터에 의해 유기적으로 지원 된다""고 설명했다.

고 대표는 ""특히 음성봇은 각 특정분야의 기술이 서로 융합돼 실현, 콜센터 인프라와 서비스 관점의 연동을 지원하고 있다""고 덧붙였다.

'아이작'을 만든 한솔인티큐브는 컨택센터(콜센터), IPT&UC, 모바일 메시징 등의 솔루션을 기반으로 기업 커뮤니케이션 특화 비즈니스를 전개하고 있다. 전신인 로커스부터 시작해 지난 20여년 간 꾸준한 상품 개발과 신기술 도입, 전략적 파트너십 등으로 한단계 진보한 커뮤니케이션 서비스 제공에 매진하고 있다.

■CEO 인터뷰/고광선 대표

""한솔인티큐브는 2003년 설립이래 지난 16년간 비즈니스 커뮤니케이션 영역을 개척, 이 분야 대표적 전문기업으로 자리잡았습니다. 주로 컨택 센터 인프라와 응용솔루션 및 모바일 서비스를 제공하고 있습니다.""

고광선 한솔인티큐브 대표는 ""최근 빅데이터와 인공지능 클라우드 서비스를 개발하는 등 사업영역을 확장하고 있다""면서 이 같이 밝혔다.


한솔인티큐브는 컨택센터 사업 외에도 무선 커뮤니케이션 영역 솔루션도 공급하고 있다. 단순 문자 메시지에서 멀티미디어 메시지, 스팸 차단,가상 번호 등 메시징 분야의 다양한 솔루션 및 특허를 보유하고 있다.

2017년 말, 인공지능과 빅데이터 기술을 활용한 AI커뮤니케이션 브랜드 아이작(ISAC: Intelligence Solution for Advanced Communication)과 KT, 제너시스(Genesys)와 협업해 탄생한 옴니채널 클라우드 콜센터 ‘C-Cloud(Communication Cloud)’ 등 B2B 뿐만 아니라 B2C 영역으로 사업을 확대하고 있다.

한솔인티큐브는 ""유연하고 효율적인 서비스로 고객사에 가장 적합한 솔루션을 제안한다""면서 ""컨설팅부터 설치, 운영 및 유지보수까지 고객에게 A to Z의 토탈 커뮤니케이션 솔루션을 제공하고 있다""고 강조했다.

서울 상암동 누리꿈스퀘어 비즈니스센터에 본사가 있는 한솔인티큐브는 컨택 센터 사업 외에 무선 커뮤니케이션 분야 솔루션도 공급하고 있다. 단순 문자 메시지에서 멀티미디어 메시지, 스팸 차단,가상 번호 등 메시징 분야의 다양한 솔루션 및 특허를 보유하고 있다.

고 대표는 ""우리의 주 사업 영역인 컨택센터(콜센터) 시장은 B2B, 특히 대기업에 특화한 영역이었지만 인공지능과 클라우드와 같은 신기술 등장으로 중소규모 기업과 개인 사업자에도 적합한 서비스가 됐다""면서 ""이런 상황에 맞춰 내년에는 해당 고객 층을 위한 맞춤형 서비스를 선보일 예정""이라고 밝혔다.

그는 ""다양한 대 고객 채널을 개설해 고객 접근성 과 B2C 및 SMB 영역에서 브랜드 인지도를 높여나가겠다""고 강조했다.",,,,,,,,,,,,,,,,,,,,,
156,한솔인티큐브(주),2022-12-27,"한솔인티큐브, 세라젬 통합 컨택센터 시스템 구축 완료","한솔인티큐브가 세라젬의 컨택센터 구축을 성공적으로 완료했다고 27일 밝혔다. 이번 사업은 세라젬 통합 CRM 구축 사업 중 하나로 다양한 경로를 통해 얻어지는 고객 정보를 데이터화하고 고객상담에 빠르게 활용할 수 있는 환경을 마련했다는 점에서 의의가 있다.

이번 세라젬의 컨택센터에는 대기업 및 금융권에서 성능과 안정성이 검증된 장비와 한솔인티큐브의 솔루션이 함께 사용되어 세라젬의 고객 상담업무에 최적화된 운영 환경이 구축되었다.



한솔인티큐브는 PBX, CTI, IVR, 아웃바운드 녹취 등 콜센터 운영에 필요한 장비와 솔루션 뿐만 아니라 보이는 ARS, 문자 상담, 영상 상담 솔루션도 함께 구축하여, 여러 상담 솔루션을 연계한 상담 업무 최적화 및 상담 데이터 품질 향상에 기여하게 됐다.

특히 시스템이 상담사 대신 자동으로 고객에게 전화를 걸고 연결해주는 PDS솔루션으로 업무생산성 향상, 상담사 만족도 제고, 불완전판매율 감소 및 TM업무 품질 향상을 함께 기대할 수 있게 되었다.

더불어 휴대전화 음성 채널로 연결된 고객에게도 팝업 화면을 통해 디지털 채널 상담 기능을 자연스럽게 제공할 수 있는 “보이는 ARS ”, 고객의 현재 상태를 명확하게 확인하고 대응할 수 있는 “영상 상담”, 쉽고 간편하게 문의할 수 있는 “문자 상담” 등 고객과의 상담 방식을 다양하게 확대 할 수 있는 솔루션이 적용되어 세라젬의 상담업무 편의성은 물론 효율성도 크게 높아질 전망이다.

한솔인티큐브 관계자는 '30년 이상의 컨택센터 구축 노하우를 적극 활용하여 세라젬의 통합 컨택센터 시스템을 구축했다'고 말하면서 '고객의 이용패턴에 대응하여 통합적으로 관리할 수 있는 이번 컨택센터가 세라젬의 고객서비스 품질 향상에 크게 기여할 수 있게 되길 바란다'고 전했다.",,,,,,,,,,,,,,,,,,,,,
157,한솔인티큐브(주),2023.03.09 ,"한솔인티큐브, 코어에이아이와 대화형 AI 플랫폼 기반 AICC 사업 활성화","AI컨택센터 전문 기업 한솔인티큐브는 글로벌 대화형 인공지능(AI) 플랫폼 선도 기업 코어에이아이와 AICC(인공지능 컨택센터) 사업 활성화를 위한 파트너십을 체결했다고 9일 밝혔다.

코어에이아이는 글로벌 2000대 기업이 선호하는 대화형 AI 및 디지털 UX 기술 공급업체다.

코어에이아이는 미국 올랜도에 본사를 두고 있다. 2015년 설립 이후 현재 글로벌 상위 4개 은행을 포함해 포춘 500대 기업 중 100개 이상의 기업들이 코어에이아이의 AI 솔루션을 이용하고 있다.

한솔인티큐브는 이번 파트너십 체결을 통해 자사의 AICC 솔루션에 글로벌 AI 선도 기업인 코어에이아이의 AI 기술을 접목한다. 상담원들이 보다 정확하고 빠르게 고객 맞춤형 상담을 제공할 수 있도록 함으로써 경쟁력을 제고한다는 방침이다.

양사는 향후 지속적인 협력을 통해 AICC 분야에서 공동 사업 기회를 만들어 나갈 예정이다. 사업의 성공적 발굴 및 수행을 위해 기술 교육, 마케팅에도 적극적으로 협력할 방침이다.

또 양사는 한솔인티큐브의 AICC 솔루션과 코어에이아이의 대화형 AI 서비스를 연계한 통합 솔루션을 구현할 계획이다.

한솔인티큐브는 코어에이아이의 거대언어모델(LLM)과 생성형 AI 기술을 활용해 현재 대화 시나리오 제작과 자연어처리 학습에 투입되는 사람의 수작업을 제거함으로써 챗GPT와 같은 대화형 AI 서비스를 개발할 뿐만 아니라 이에 필요한 비용과 운영 효율성도 개선할 예정이다.

한솔인티큐브 관계자는 ""이번 파트너십을 통해 대화형 AI 플랫폼에 연계된 서비스를 발굴하고 AICC 시장에 선보일 수 있는 기회를 마련하게 됐다""며 ""한솔인티큐브의 기술력과 코어에이아이의 대화형 AI 플랫폼 기술이 시너지를 창출해 국내시장에 자리매김할 수 있도록 노력할 것""이라고 말했다.

",,,,,,,,,,,,,,,,,,,,,
158,한솔인티큐브(주),2021.12.01,"한솔인티큐브 ""비대면 고객응대 강화, 이제는 챗봇 아닌 콜봇""","코로나19(COVID-19)가 좀체 가라앉지 않으며 비대면 방식의 고객응대가 정착하는 가운데 한솔인티큐브 (1,214원 ▲20 +1.68%)가 AI(인공지능)를 활용한 '콜봇'(Call-bot) 수주를 이어가고 있다. AI 시스템이 직접 고객과 음성으로 소통하며 서비스를 제공하는 사례가 늘어나고 있기 때문이다.

1일 한솔인티큐브에 따르면 이 회사는 최근 신한금융투자의 클라우드·AI 디지털 컨택센터 구축을 수주했다. 금융권 컨택센터(옛 콜센터) 구축 및 운용 등이 이 회사의 주력 사업이다. 또 라이나생명 CS 보이스봇(Voice-bot) 구축 프로젝트도 수주해 진행 중이다.



한솔인티큐브는 2018년 아이작(ISAC)이라는 인공지능 브랜드를 론칭한 후 AI 콜봇 사업에 진출, IBM과 함께 현대카드 인바운드 콜봇을 개발한 바 있다. 2019년에는 KB손해보험 긴급출동 콜봇, 한화생명 및 신한금융투자의 인바운드 콜봇 구축사업 등을 수주한 이력도 있다.

그간 국내 금융권의 컨택센터는 고객과 채팅이 중심인 챗봇(Chat-bot)이 주류였지만 최근에는 고객 음성을 듣고 음성으로 답해주는 콜봇의 사용이 늘어나고 있다고 한다. 컨택센터에서도 AI 활용이 보편화되면서 기존 문자 대화를 넘어 음성 통화로 고객을 응대하게 된 것이다.

특히 콜봇은 금융권 활용도가 높다. 은행·증권 등 금융사들은 다양한 고객과 수많은 상품에 대한 설명 및 대화를 하기 위해 음성으로 상담해야 할 일이 많기 때문이다. 상담원 통화연결 지연에 따른 고객 불편도 줄어들 것으로 전망된다.

서상철 한솔인티큐브 인공지능융합연구팀 이사는 ""금융권에서 24시간 AI로 처리할 수 있는 콜봇 서비스 도입 사례는 앞으로도 더 늘 것""이라며 ""AI 엔진 성능 업그레이드를 통해 금융권 컨택센터 고도화에 앞장설 것""이라고 했다.
",,,,,,,,,,,,,,,,,,,,,
159,한솔인티큐브(주),2017.10.23,"SK C&C-한솔인티큐브, AI 컨택센터 개발한다","SK㈜ C&C의 ‘에이브릴(Aibril)’이 고객 콜센터를 지능화된 AI 컨택센터로 변신시킨다
SK㈜ C&C는 23일 분당 사옥에서 이문진 에이브릴 사업본부장과 한솔인티큐브의 이종민 CRM사업본부장 등 10여명이 참석한 가운데 ‘에이브릴 기반 인공지능 컨택센터 솔루션 개발을 위한 전략적 솔루션 파트너십(SSP:Strategic Solution Partner) 계약’을 체결했다.

컨택센터는 기존 전화 응대 위주였던 콜센터의 발전된 형태로 전화·문자·웹페이지·이메일·SNS·채팅 등 다양한 채널을 통해 고객과 소통하는 통합 고객 센터를 말한다.

한솔인티큐브는 금융·보험·통신·유통 등 다양한 산업군에서 고객을 보유하고 있는 국내 1위 컨택센터 구축 전문기업으로서 최근에는 빅데이터와 인공지능을 활용한 차세대 컨택센터 사업을 강화하고 있다.

이번 계약에 따라 양사는 에이브릴을 기반으로 고객 접촉 채널 전반을 하나로 묶으며 옴니채널을 실현하는 ‘한솔인티큐브 AI 컨택센터 전용봇’을 개발한다.

AI 컨택센터 전용봇에 ‘가상 상담원(Virtual Agent)’과 ‘상담원 보조(Agent Assistant)’를 구현해 채팅·전화·이메일·SNS 등 다양한 채널로 들어오는 고객 상담 과정·내용을 모니터링하면서 고객 선호에 따른 맞춤형 고객 상담을 지원한다는 방침이다.

전용봇의 ‘가상 상담원’은 챗봇 형태로 온라인 상에서 고객의 상품 및 서비스 관련 질문에 답변하며 고객에게 맞는 최적의 상품과 서비스를 추천하는 역할을 맡는다. 심층 상담을 원하는 고객은 챗봇 대화창에서 상담원과 직접 전화·채팅도 할 수 있다. ‘상담원 보조 서비스’는 상담원의 모니터에 고객관련 모든 기존 상담 내용을 표출시키는 동시에 추천 답변을 제시함으로써 상담의 질을 높여준다

고객이 어떤 형태의 상담 채널을 선택하든지 같은 이야기를 반복할 필요가 없고, 언제나 준비된 상담사로부터 개인화된 서비스를 받게 되는 것이다.

한솔인티큐브 이종민 CRM사업본부장은 “차세대 컨택센터는 4차 산업혁명 시대를 맞아 축소가 아닌 고객 최전방의 전략적 요충지로서 역할을 확대해나갈 것이다.”라며 “한솔인티큐브 AI 컨택센터 전용봇은 고객과 상담원, 기업 고객 모두를 만족시키는 솔루션이 될 것”이라고 의지를 밝혔다.

SK(주) C&C 이문진 사업본부장은 “이번 협력을 계기로 국내 컨택센터의 인공지능 서비스 시대를 열어 가겠다”며 “한솔인티큐브와 함께 신규 컨택센터 구축 고객 발굴뿐 아니라 기존 고객의 컨택센터 업그레이드 수요도 창출하겠다”고 말했다.

SK(주) C&C는 앞으로도 주요 산업별 에이브릴 기반 전문솔루션을 개발하고자 하는 기업들을 대상으로 ‘전략적 솔루션 파트너십(SSP)’ 프로그램을 지속적으로 확대한다는 계획이다.",,,,,,,,,,,,,,,,,,,,,
